year,month,day,title,file
2023,05,18,Palestinians brace as far-right Israelis march in East Jerusalem,data_in/articles\2023-05-18_3555.txt
2023,05,18,"In Haifa, Israel sells Palestinian homes as luxury real estate",data_in/articles\2023-05-18_3556.txt
2023,05,21,Israel far-right minister visits Al-Aqsa compound,data_in/articles\2023-05-21_3549.txt
2023,05,22,Determined Palestinian youth pledge to fight for liberation,data_in/articles\2023-05-22_3546.txt
2023,05,22,Three Palestinians killed by Israeli forces in raid on Nablus,data_in/articles\2023-05-22_3547.txt
2023,05,22,US rebukes Israel over Homesh illegal settlement order,data_in/articles\2023-05-22_3548.txt
2023,05,23,"Najwa, a Palestinian woman paralysed in Israel’s assault on Gaza",data_in/articles\2023-05-23_3545.txt
2023,05,24,US elections 2024: Who is the Republican contender Ron DeSantis?,data_in/articles\2023-05-24_3543.txt
2023,05,24,Israel postpones parole session for writer Walid Daqqa,data_in/articles\2023-05-24_3544.txt
2023,05,25,‘War crime’: Israel forcibly transfers Palestinian village,data_in/articles\2023-05-25_3541.txt
2023,05,25,Israel military court jails soldiers for abusing Palestinian man,data_in/articles\2023-05-25_3542.txt
2023,05,26,Israeli settler kills Palestinian after alleged stabbing attack,data_in/articles\2023-05-26_3539.txt
2023,05,26,‘Civil society killer’: Israel tax bill threatens to silence NGOs,data_in/articles\2023-05-26_3540.txt
2023,05,27,Pink Floyd’s Roger Waters says Berlin gig controversy a ‘smear’,data_in/articles\2023-05-27_3538.txt
2023,05,28,"‘Day of mourning’: 200,000 Palestinian families lose UN food aid",data_in/articles\2023-05-28_3537.txt
2023,05,29,Palestinian Authority officer killed by Israeli forces in Jenin,data_in/articles\2023-05-29_3534.txt
2023,05,29,Photos: Memories of Nakba inspire Palestinian artist’s work,data_in/articles\2023-05-29_3535.txt
2023,05,29,Not just Israel’s Ben-Gvir: A new Al-Aqsa provocation is rising,data_in/articles\2023-05-29_3536.txt
2023,05,30,Israeli shot dead near illegal settlement in occupied West Bank,data_in/articles\2023-05-30_3532.txt
2023,05,30,Walid Daqqa’s defiance and suffering while in Israeli custody,data_in/articles\2023-05-30_3533.txt
2023,05,31,‘Bullying’ campaign after US graduate speech criticises Israel,data_in/articles\2023-05-31_3531.txt
2023,06,01,‘We need protection’: Palestinians brace for Homesh resettlement,data_in/articles\2023-06-01_3530.txt
2023,06,02,Palestinian toddler seriously wounded by Israeli fire,data_in/articles\2023-06-02_3528.txt
2023,06,02,The Tories can never be true friends of Palestine,data_in/articles\2023-06-02_3529.txt
2023,06,04,‘Better to die there’: Palestinians mourn Ein Samiya displacement,data_in/articles\2023-06-04_3527.txt
2023,06,05,"US report on Abu Akleh killing must be made public, senator urges",data_in/articles\2023-06-05_3524.txt
2023,06,05,"Israel bombed this Gaza house, turning antique collection to dust",data_in/articles\2023-06-05_3525.txt
2023,06,05,"US committed to Saudi-Israeli normalisation, Blinken tells AIPAC",data_in/articles\2023-06-05_3526.txt
2023,06,06,Hundreds of Palestinians bury toddler killed by Israeli forces,data_in/articles\2023-06-06_3523.txt
2023,06,08,‘Enduring commitment’: Key takeaways from US-GCC joint statement,data_in/articles\2023-06-08_3520.txt
2023,06,08,Middle East roundup: Palestinian toddler killed by Israeli forces,data_in/articles\2023-06-08_3521.txt
2023,06,08,Three shot as Israeli forces raid Ramallah in occupied West Bank,data_in/articles\2023-06-08_3522.txt
2023,06,09,Palestinian killed by Israeli forces at Rantis checkpoint,data_in/articles\2023-06-09_3518.txt
2023,06,09,Palestinian President Abbas to visit China after mediation offer,data_in/articles\2023-06-09_3519.txt
2023,06,10,‘Collective punishment’: Israel demolishes Palestinian homes,data_in/articles\2023-06-10_3517.txt
2023,06,13,Israeli army kills Palestinian in occupied West Bank raid,data_in/articles\2023-06-13_3515.txt
2023,06,13,Why Shin Bet may be used to police Palestinian areas in Israel,data_in/articles\2023-06-13_3516.txt
2023,06,14,US to address killing of American citizen ‘directly’ with Israel,data_in/articles\2023-06-14_3511.txt
2023,06,14,China’s Xi Jinping backs ‘just cause’ of Palestinian statehood,data_in/articles\2023-06-14_3512.txt
2023,06,14,The family behind a unique Palestinian football club,data_in/articles\2023-06-14_3513.txt
2023,06,14,Israeli forces face no charges over death of Palestinian-American,data_in/articles\2023-06-14_3514.txt
2023,06,15,Funeral held for young man killed by Israeli forces in Nablus,data_in/articles\2023-06-15_3509.txt
2023,06,15,Israel says Palestinian toddler killed ‘unintentionally’,data_in/articles\2023-06-15_3510.txt
2023,06,16,The real problem with Israel’s ‘collective punishment’,data_in/articles\2023-06-16_3508.txt
2023,06,17,Four Hajj delegations leave besieged Gaza to Mecca,data_in/articles\2023-06-17_3506.txt
2023,06,17,Ban on Israelis could see Indonesia lose World Beach Games,data_in/articles\2023-06-17_3507.txt
2023,06,19,Israeli forces raid Jenin refugee camp,data_in/articles\2023-06-19_3503.txt
2023,06,19,Israel-Palestine updates: 5 killed as Israeli troops raid Jenin,data_in/articles\2023-06-19_3504.txt
2023,06,19,Five Palestinians killed as Israeli forces raid West Bank camp,data_in/articles\2023-06-19_3505.txt
2023,06,20,What is behind the rise in violence in the occupied West Bank?,data_in/articles\2023-06-20_3496.txt
2023,06,20,Latest updates: 2 Palestinians killed after West Bank shootings,data_in/articles\2023-06-20_3497.txt
2023,06,20,Four Israeli settlers killed in attack in the occupied West Bank,data_in/articles\2023-06-20_3498.txt
2023,06,20,Gaza’s blockade: Palestine’s Nakba lives on in new generations,data_in/articles\2023-06-20_3499.txt
2023,06,20,Why does Israel keep raiding the Jenin refugee camp?,data_in/articles\2023-06-20_3500.txt
2023,06,20,Sixth Palestinian dies after Israeli raid on Jenin refugee camp,data_in/articles\2023-06-20_3501.txt
2023,06,20,UN chief tells Israel to halt illegal settlements in Palestine,data_in/articles\2023-06-20_3502.txt
2023,06,21,Israel drone attack kills 3 in occupied West Bank car attack,data_in/articles\2023-06-21_3493.txt
2023,06,21,Palestinian killed as Israeli settlers attack West Bank village,data_in/articles\2023-06-21_3494.txt
2023,06,21,Hundreds attend funeral for Palestinians killed in Jenin raids,data_in/articles\2023-06-21_3495.txt
2023,06,22,"Mourning a home filled with memories, destroyed by Israel’s army",data_in/articles\2023-06-22_3488.txt
2023,06,22,Israeli settlers set up new illegal outpost on Palestinian land,data_in/articles\2023-06-22_3489.txt
2023,06,22,Why China can’t broker peace between Israel and Palestine,data_in/articles\2023-06-22_3490.txt
2023,06,22,‘He was my life’: The people killed by Israeli forces in Jenin,data_in/articles\2023-06-22_3491.txt
2023,06,22,Israeli army uses force against Druze protests in occupied Golan,data_in/articles\2023-06-22_3492.txt
2023,06,23,US says ‘engaging’ with Israel after West Bank settler attacks,data_in/articles\2023-06-23_3483.txt
2023,06,23,Will we see a major Israeli assault in the occupied West Bank?,data_in/articles\2023-06-23_3484.txt
2023,06,23,"Middle East roundup: Jenin, the refugee camp on Israel’s radar",data_in/articles\2023-06-23_3485.txt
2023,06,23,UN slams Israel’s use of ‘advanced military weaponry’ in Jenin,data_in/articles\2023-06-23_3486.txt
2023,06,23,"Russia on UN ‘list of shame’ for killing children, Israel absent",data_in/articles\2023-06-23_3487.txt
2023,06,24,Israeli forces kill Palestinian teen after checkpoint shooting,data_in/articles\2023-06-24_3482.txt
2023,06,25,Israeli forces say will clamp down on settler ‘terrorism’,data_in/articles\2023-06-25_3481.txt
2023,06,26,Anger as violent crime soars in Israel’s Palestinian communities,data_in/articles\2023-06-26_3479.txt
2023,06,26,Israel approves plans for thousands of illegal settlement homes,data_in/articles\2023-06-26_3480.txt
2023,06,27,Can the Palestinian Authority protect Palestinians from settlers?,data_in/articles\2023-06-27_3478.txt
2023,06,28,Saudi Arabia-Israel normalisation difficult but possible: Blinken,data_in/articles\2023-06-28_3475.txt
2023,06,28,Palestinians wounded in Jenin raid face long road to recovery,data_in/articles\2023-06-28_3476.txt
2023,06,28,"Israeli, Palestinian officials discuss violence in West Bank",data_in/articles\2023-06-28_3477.txt
2023,06,29,"‘No singing, no joy’: How settlers ruined a Palestinian wedding",data_in/articles\2023-06-29_3473.txt
2023,06,29,"Russia and Israel both kill children. Shame both, Mr Guterres",data_in/articles\2023-06-29_3474.txt
2023,06,30,Israel accused of using ‘automated apartheid’ in West Bank,data_in/articles\2023-06-30_3472.txt
2023,07,01,"Australia, Canada, UK ‘deeply concerned’ over Israeli settlements",data_in/articles\2023-07-01_3471.txt
2023,07,02,Israel to buy new fleet of F-35 fighter jets financed by US aid,data_in/articles\2023-07-02_3470.txt
2023,07,03,‘A real massacre’: Israel’s attack on Palestinians in Jenin,data_in/articles\2023-07-03_3462.txt
2023,07,03,Steady US support gives Israel ‘cover’ to attack Jenin: Analysts,data_in/articles\2023-07-03_3463.txt
2023,07,03,"Israeli attack on Jenin a ‘new war crime’, Palestinians say",data_in/articles\2023-07-03_3464.txt
2023,07,03,What is behind Israel’s major attack on Jenin?,data_in/articles\2023-07-03_3465.txt
2023,07,03,"‘Criminal’: Israel’s Jenin attack sparks condemnation, alarm",data_in/articles\2023-07-03_3466.txt
2023,07,03,"Jenin updates: Palestinian deaths rise, Israeli raid continuing",data_in/articles\2023-07-03_3467.txt
2023,07,03,Photos: Israel’s deadly air raids on Jenin refugee camp,data_in/articles\2023-07-03_3468.txt
2023,07,03,Nine Palestinians killed as Israel attacks Jenin refugee camp,data_in/articles\2023-07-03_3469.txt
2023,07,04,‘No mercy’: Palestinians describe Israel’s deadly raid on Jenin,data_in/articles\2023-07-04_3458.txt
2023,07,04,"Aid groups alarmed at Jenin access curbs, scale of Israeli attack",data_in/articles\2023-07-04_3459.txt
2023,07,04,At least 7 hurt in Tel Aviv car-ramming and stabbing attack,data_in/articles\2023-07-04_3460.txt
2023,07,04,Jenin updates: Israel hits Gaza after 12 killed in Jenin raid,data_in/articles\2023-07-04_3461.txt
2023,07,05,"Believe it or not, justice will prevail in Palestine",data_in/articles\2023-07-05_3453.txt
2023,07,05,‘They can’t break our spirit’: Jenin residents after Israel siege,data_in/articles\2023-07-05_3454.txt
2023,07,05,Israel bombs Gaza following Jenin assault,data_in/articles\2023-07-05_3455.txt
2023,07,05,Jenin updates: Residents start rebuilding after Israeli attack,data_in/articles\2023-07-05_3456.txt
2023,07,05,Why did Israel use helicopter gunships on Jenin refugee camp?,data_in/articles\2023-07-05_3457.txt
2023,07,06,Is Israel’s attack on Jenin a war crime?,data_in/articles\2023-07-06_3446.txt
2023,07,06,Israeli court acquits officer of killing autistic Palestinian man,data_in/articles\2023-07-06_3447.txt
2023,07,06,Photos: The wreckage Israel left behind in Jenin refugee camp,data_in/articles\2023-07-06_3448.txt
2023,07,06,Israeli soldier killed in settlement attack; gunman shot dead,data_in/articles\2023-07-06_3449.txt
2023,07,06,‘Disaster’: Palestinian homes used as Israeli bases in Jenin,data_in/articles\2023-07-06_3450.txt
2023,07,06,Israel attacks launch site in Lebanon after rockets ‘fired’,data_in/articles\2023-07-06_3451.txt
2023,07,06,Did Israel achieve its goals in Jenin?,data_in/articles\2023-07-06_3452.txt
2023,07,07,Analysis: Can Islamic Jihad survive Israel’s assassination drive?,data_in/articles\2023-07-07_3441.txt
2023,07,07,Middle East roundup: Israel pounds West Bank refugee camp,data_in/articles\2023-07-07_3442.txt
2023,07,07,"Israeli forces kill three Palestinians in Nablus, Ramallah",data_in/articles\2023-07-07_3443.txt
2023,07,07,History Illustrated: The Jenin refugee camp story,data_in/articles\2023-07-07_3444.txt
2023,07,07,UN chief Guterres condemns Israel’s raid on Jenin refugee camp,data_in/articles\2023-07-07_3445.txt
2023,07,08,EU envoy blasts Israel over deadly Jenin raid,data_in/articles\2023-07-08_3436.txt
2023,07,08,The pillage of Jenin: Israel’s spin wears thin,data_in/articles\2023-07-08_3437.txt
2023,07,08,Israel won’t criminally charge five officers for 2021 Gaza attack,data_in/articles\2023-07-08_3438.txt
2023,07,08,Why the Western media lied about Israel’s Jenin siege,data_in/articles\2023-07-08_3439.txt
2023,07,08,UN chief refuses to retract condemnation of Israel’s Jenin raid,data_in/articles\2023-07-08_3440.txt
2023,07,10,US and Israel start joint military exercise,data_in/articles\2023-07-10_3433.txt
2023,07,10,Palestinian killed after allegedly shooting at Israeli soldier,data_in/articles\2023-07-10_3434.txt
2023,07,10,Jenin raid is over. Palestinians are left to cope with the trauma,data_in/articles\2023-07-10_3435.txt
2023,07,11,Israel expels Sub Labans from their home in Jerusalem’s Old City,data_in/articles\2023-07-11_3430.txt
2023,07,11,Daily life returns to Jenin camp after Israeli raid,data_in/articles\2023-07-11_3431.txt
2023,07,11,UN told Israel turns Palestinian territory into outdoor prison,data_in/articles\2023-07-11_3432.txt
2023,07,12,Palestinian leader Abbas visits Jenin camp after Israeli raid,data_in/articles\2023-07-12_3428.txt
2023,07,12,Settler faces ‘terrorism’ charges over West Bank mosque vandalism,data_in/articles\2023-07-12_3429.txt
2023,07,13,Middle East roundup: Tunisia expels terrified Africans to borders,data_in/articles\2023-07-13_3424.txt
2023,07,13,What the Jenin raids mean for the Palestinian Authority,data_in/articles\2023-07-13_3425.txt
2023,07,13,"Israel wants to turn Jenin into another Gaza, siege by siege",data_in/articles\2023-07-13_3426.txt
2023,07,13,What Palestinians in Jenin camp did to block the Israeli army,data_in/articles\2023-07-13_3427.txt
2023,07,14,Israel sets record for illegal settlement approvals: Rights group,data_in/articles\2023-07-14_3422.txt
2023,07,14,Why do some Palestinian teens in Jenin dream of ‘martyrdom’?,data_in/articles\2023-07-14_3423.txt
2023,07,15,Life as a resistance fighter in Jenin: ‘Only death can stop us’,data_in/articles\2023-07-15_3420.txt
2023,07,15,How Israel weaponises museums to erase Palestinian existence,data_in/articles\2023-07-15_3421.txt
2023,07,16,"Three Israelis wounded in Palestinian attack, gunman arrested",data_in/articles\2023-07-16_3419.txt
2023,07,17,"West Bank ‘not occupied’ territory, says Ron DeSantis",data_in/articles\2023-07-17_3417.txt
2023,07,17,"As Herzog visits US, advocates urge action against Israeli abuses",data_in/articles\2023-07-17_3418.txt
2023,07,18,"Israel ‘not a racist’ state, US House resolution proclaims",data_in/articles\2023-07-18_3415.txt
2023,07,18,US groups demand Abu Akleh probe via Justice for Shireen Act,data_in/articles\2023-07-18_3416.txt
2023,07,19,"Israel prays for ties with Saudi Arabia, Herzog tells US Congress",data_in/articles\2023-07-19_3412.txt
2023,07,19,Shooting the Messenger: Journalism under fire by the Israeli army,data_in/articles\2023-07-19_3413.txt
2023,07,19,Israel President Herzog’s ‘honest’ speech to the US Congress,data_in/articles\2023-07-19_3414.txt
2023,07,20,Canada’s Trudeau ‘concerned’ about Netanyahu’s policies,data_in/articles\2023-07-20_3408.txt
2023,07,20,Tunnels under Jenin camp: How Palestinian fighters fooled Israel,data_in/articles\2023-07-20_3409.txt
2023,07,20,Inside the eviction of Palestinians losing their Jerusalem home,data_in/articles\2023-07-20_3410.txt
2023,07,20,"Israeli forces kill Palestinian, injure 4 in occupied West Bank",data_in/articles\2023-07-20_3411.txt
2023,07,21,Israeli forces kill two Palestinian teens in occupied West Bank,data_in/articles\2023-07-21_3407.txt
2023,07,22,Palestinians call for probe into Israeli killing of teenager,data_in/articles\2023-07-22_3406.txt
2023,07,23,An Israeli civil war?,data_in/articles\2023-07-23_3405.txt
2023,07,24,Passage of Israel’s judicial reform entrenches ‘Jewish supremacy’,data_in/articles\2023-07-24_3404.txt
2023,07,25,Three Palestinians killed by Israeli forces in occupied West Bank,data_in/articles\2023-07-25_3403.txt
2023,07,26,Palestinian teen killed by Israeli forces in occupied West Bank,data_in/articles\2023-07-26_3400.txt
2023,07,26,Israeli troops kill Palestinian man during West Bank raid,data_in/articles\2023-07-26_3401.txt
2023,07,26,Erdogan-Abbas meet: Turkey concerned over Israel settler attacks,data_in/articles\2023-07-26_3402.txt
2023,07,27,Weaponising water in Palestine,data_in/articles\2023-07-27_3397.txt
2023,07,27,Israeli protests cast light on laws discriminating against Palestinians,data_in/articles\2023-07-27_3398.txt
2023,07,27,Israeli far-right minister leads incursion of Al-Aqsa compound,data_in/articles\2023-07-27_3399.txt
2023,07,28,Israel’s US visa waiver push draws anger among Palestinian Americans,data_in/articles\2023-07-28_3394.txt
2023,07,28,‘He didn’t want to die’: Mourning Palestinian teenager Faris Abu Samra,data_in/articles\2023-07-28_3395.txt
2023,07,28,What’s behind Israel’s ‘judicial coup’?,data_in/articles\2023-07-28_3396.txt
2023,07,31,Road to normalising ties with Saudi Arabia ‘still long’: Israeli official,data_in/articles\2023-07-31_3393.txt
2023,08,01,Palestinian shot dead after six Israelis wounded in illegal settlement,data_in/articles\2023-08-01_3392.txt
2023,08,02,US wants an Israeli-Saudi ‘normalisation’ deal. Why now?,data_in/articles\2023-08-02_3391.txt
2023,08,04,"Two Palestinians killed by Israeli army, settlers in West Bank violence",data_in/articles\2023-08-04_3390.txt
2023,08,05,Shooter kills Tel Aviv policeman in Israel; suspect gunned down,data_in/articles\2023-08-05_3389.txt
2023,08,06,Israel forces kill three Palestinians in occupied West Bank attack,data_in/articles\2023-08-06_3388.txt
2023,08,08,Israeli minister dismisses US ‘terror’ label after deadly settler attack,data_in/articles\2023-08-08_3386.txt
2023,08,08,Israel demolishes refugee camp home of alleged Palestinian attacker,data_in/articles\2023-08-08_3387.txt
2023,08,09,US says no framework agreed yet for Israel-Saudi normalisation deal,data_in/articles\2023-08-09_3384.txt
2023,08,09,How Israeli technology turns occupation into profit,data_in/articles\2023-08-09_3385.txt
2023,08,10,Israeli forces kill Palestinian man during raid in occupied West Bank,data_in/articles\2023-08-10_3383.txt
2023,08,11,Palestinian Authority President Abbas fires occupied West Bank governors,data_in/articles\2023-08-11_3381.txt
2023,08,11,"Israeli forces kill Palestinian, wound eight, in occupied West Bank raid",data_in/articles\2023-08-11_3382.txt
2023,08,12,Palestinian officials welcome first Saudi Arabia ambassador,data_in/articles\2023-08-12_3380.txt
2023,08,15,Israeli forces kill 2 Palestinians in raid on occupied West Bank,data_in/articles\2023-08-15_3379.txt
2023,08,17,Five key issues to look out for at first US Republican debate,data_in/articles\2023-08-17_3377.txt
2023,08,17,‘He said he’d surrender’: A family in shock after Israeli raid kills son,data_in/articles\2023-08-17_3378.txt
2023,08,18,Israeli police arrest and brand Palestinian with ‘Star of David’: Report,data_in/articles\2023-08-18_3376.txt
2023,08,19,Two Israelis killed by suspected Palestinian gunman; manhunt under way,data_in/articles\2023-08-19_3375.txt
2023,08,20,How Israel targets Palestinian first responders in occupied West Bank,data_in/articles\2023-08-20_3374.txt
2023,08,21,US Republican candidates clash over support for Israel,data_in/articles\2023-08-21_3372.txt
2023,08,21,Netanyahu says Iran behind attacks as Israeli killed in Hebron shooting,data_in/articles\2023-08-21_3373.txt
2023,08,22,"New York Mayor Eric Adams meets with Netanyahu, protest leaders in Israel",data_in/articles\2023-08-22_3369.txt
2023,08,22,Palestinian teen killed in Israeli raid in northern occupied West Bank,data_in/articles\2023-08-22_3370.txt
2023,08,22,"More than 200 Palestinians, nearly 30 Israelis killed so far this year: UN",data_in/articles\2023-08-22_3371.txt
2023,08,24,Ben-Gvir says Israeli rights trump Palestinian freedom of movement,data_in/articles\2023-08-24_3368.txt
2023,08,25,Ben-Gvir lashes out at supermodel Bella Hadid over Palestinian rights,data_in/articles\2023-08-25_3367.txt
2023,08,26,Palestinian dies month after being shot during Israeli raid in West Bank,data_in/articles\2023-08-26_3366.txt
2023,08,27,‘Accusing Israel of apartheid is not anti-Semitic’: Holocaust historian,data_in/articles\2023-08-27_3364.txt
2023,08,27,"Who is Israel’s far-right, pro-settler Security Minister Ben-Gvir?",data_in/articles\2023-08-27_3365.txt
2023,08,28,Finance minister to renew funds to Palestinians in Israel after backlash,data_in/articles\2023-08-28_3359.txt
2023,08,28,Agzaya’s fight to return to her children in Israel,data_in/articles\2023-08-28_3360.txt
2023,08,28,Libya’s Foreign Minister Najla al-Mangoush dismissed: Sources,data_in/articles\2023-08-28_3361.txt
2023,08,28,Is BRICS really the lifeline Palestine needs?,data_in/articles\2023-08-28_3362.txt
2023,08,28,Papua New Guinea to open Israel embassy in Jerusalem,data_in/articles\2023-08-28_3363.txt
2023,08,30,Israeli forces kill Palestinian teenager in East Jerusalem,data_in/articles\2023-08-30_3356.txt
2023,08,30,Mural of killed journalist Shireen Abu Akleh inaugurated in Bethlehem,data_in/articles\2023-08-30_3357.txt
2023,08,30,Palestinian killed in armed confrontation with PA security services,data_in/articles\2023-08-30_3358.txt
2023,08,31,Middle East Roundup: Syrian journalist ponders disappeared father’s fate,data_in/articles\2023-08-31_3351.txt
2023,08,31,The fruits of Palestine and their symbolism,data_in/articles\2023-08-31_3352.txt
2023,08,31,Germany’s immigration authorities accused of ‘anti-Palestinian repression’,data_in/articles\2023-08-31_3353.txt
2023,08,31,Israeli soldier killed in car ramming attack by Palestinian,data_in/articles\2023-08-31_3354.txt
2023,08,31,"Angry, ugly Israel, where a Palestinian is branded with a Star of David",data_in/articles\2023-08-31_3355.txt
2023,09,01,Palestinian killed in crossfire after Israeli raid on West Bank town,data_in/articles\2023-09-01_3350.txt
2023,09,05,"Who is Jacob Lew, Biden’s nominee for US ambassador to Israel?",data_in/articles\2023-09-05_3347.txt
2023,09,05,"Israel kill two Palestinians, destroys even more of Nur Shams camp",data_in/articles\2023-09-05_3348.txt
2023,09,05,"Israel halts exports from Gaza at key crossing, says explosives found",data_in/articles\2023-09-05_3349.txt
2023,09,06,Libya’s anti-Israel protests and the future of normalising relations,data_in/articles\2023-09-06_3346.txt
2023,09,07,‘Lifeline for Gaza’: Businesses raise concerns after Israel halts exports,data_in/articles\2023-09-07_3345.txt
2023,09,08,Gaza exports to resume after Israel agrees to reopen vital crossing,data_in/articles\2023-09-08_3343.txt
2023,09,08,Middle East Roundup: Calligraffiti artist paints Gaza’s hope,data_in/articles\2023-09-08_3344.txt
2023,09,10,Meta deletes Al Jazeera presenter’s profile after show criticising Israel,data_in/articles\2023-09-10_3342.txt
2023,09,13,Growing up Palestinian after the Oslo Accords,data_in/articles\2023-09-13_3340.txt
2023,09,13,What were the Oslo Accords between Israel and the Palestinians?,data_in/articles\2023-09-13_3341.txt
2023,09,14,"In West Bank, Israel continues to hold back Palestinian development",data_in/articles\2023-09-14_3337.txt
2023,09,14,"Middle East Roundup: Disaster in North Africa – Morocco quake, Libya floods",data_in/articles\2023-09-14_3338.txt
2023,09,14,The Oslo peace accords: Historic achievement or historic tragedy?,data_in/articles\2023-09-14_3339.txt
2023,09,15,‘Bold and beloved’: Palestinians mourn teenager killed by Israel,data_in/articles\2023-09-15_3335.txt
2023,09,15,Map: Which MENA countries have diplomatic ties with Israel?,data_in/articles\2023-09-15_3336.txt
2023,09,17,Israeli forces attack Palestinian worshippers at Al-Aqsa Mosque,data_in/articles\2023-09-17_3333.txt
2023,09,17,"Three years on, how have the Abraham Accords helped the UAE?",data_in/articles\2023-09-17_3334.txt
2023,09,19,"Israel kills six Palestinians in occupied West Bank, Gaza",data_in/articles\2023-09-19_3332.txt
2023,09,20,Saudi Crown Prince MBS says Israel normalisation getting ‘closer’,data_in/articles\2023-09-20_3330.txt
2023,09,20,"Israel-Saudi Arabia ‘normalisation’ deal in reach, Netanyahu tells Biden",data_in/articles\2023-09-20_3331.txt
2023,09,21,Abbas tells UN peace only possible when Palestinians get full rights,data_in/articles\2023-09-21_3328.txt
2023,09,21,"Palestinian boy discovers undercover Israeli forces, they kill him: DCIP",data_in/articles\2023-09-21_3329.txt
2023,09,22,Israeli military attacks Gaza Strip amid protests at border,data_in/articles\2023-09-22_3325.txt
2023,09,22,"Palestinians must not have veto over Arab-Israel deals, Netanyahu tells UN",data_in/articles\2023-09-22_3326.txt
2023,09,22,Israeli forces kill Palestinian in northern West Bank raid,data_in/articles\2023-09-22_3327.txt
2023,09,24,Israel kills two Palestinians amid surge in military raids,data_in/articles\2023-09-24_3324.txt
2023,09,25,Israel foreign minister says US will allow visa-free travel for Israelis,data_in/articles\2023-09-25_3323.txt
2023,09,27,‘State of emergency’: Six Palestinian citizens of Israel killed in one day,data_in/articles\2023-09-27_3321.txt
2023,09,27,Biden administration confirms it will let Israelis travel visa-free to US,data_in/articles\2023-09-27_3322.txt
