year,month,day,title,file
2024,01,01,Iran deploys warship to Red Sea amid soaring tensions,data_in/articles\2024-01-01_1535.txt
2024,01,01,"Israel flattened my home, killed my family. I still lit a candle for 2024",data_in/articles\2024-01-01_1536.txt
2024,01,01,"‘Completely alienated’: British Muslims on Labour, Tory stance on Gaza war",data_in/articles\2024-01-01_1537.txt
2024,01,01,US sinks Houthi boats in the Red Sea: How did the fight unfold?,data_in/articles\2024-01-01_1538.txt
2024,01,01,Analysis: Is the Israeli army as militarily successful as it claims?,data_in/articles\2024-01-01_1539.txt
2024,01,01,"Israel’s war on Gaza: List of key events, day 87",data_in/articles\2024-01-01_1540.txt
2024,01,02,Biden under pressure to act amid new fears of ‘ethnic cleansing’ in Gaza,data_in/articles\2024-01-02_1523.txt
2024,01,02,What does a ‘new phase’ in Israel’s war on Gaza entail?,data_in/articles\2024-01-02_1524.txt
2024,01,02,Senior Hamas official Saleh al-Arouri killed in Beirut suburb,data_in/articles\2024-01-02_1525.txt
2024,01,02,Israel promises to fight South Africa genocide accusation at ICJ,data_in/articles\2024-01-02_1526.txt
2024,01,02,Israeli army launches attacks on targets in Syria and Lebanon,data_in/articles\2024-01-02_1527.txt
2024,01,02,"Israel maintains onslaught as Gaza death toll tops 22,000",data_in/articles\2024-01-02_1528.txt
2024,01,02,The Take: Are Hezbollah and Israel close to an all-out war?,data_in/articles\2024-01-02_1529.txt
2024,01,02,Survivors of Israel’s siege of Beirut see history repeating itself in Gaza,data_in/articles\2024-01-02_1530.txt
2024,01,02,What’s really at stake in the US moves to target TikTok?,data_in/articles\2024-01-02_1531.txt
2024,01,02,"Israel’s war on Gaza: List of key events, day 88",data_in/articles\2024-01-02_1532.txt
2024,01,03,US-led coalition warns Houthis of ‘consequences’ after Red Sea attacks,data_in/articles\2024-01-03_1511.txt
2024,01,03,Hezbollah chief says group won’t ‘be silent’ after killing of Hamas leader,data_in/articles\2024-01-03_1512.txt
2024,01,03,"‘Israeli warning’: Beirut bombing sparks anger, fear in Lebanon",data_in/articles\2024-01-03_1513.txt
2024,01,03,Who were the Hamas officials killed in Beirut?,data_in/articles\2024-01-03_1514.txt
2024,01,03,How will Hamas react to the killing of one of its top leaders?,data_in/articles\2024-01-03_1515.txt
2024,01,03,General strikes across West Bank after assassination of Hamas’s al-Arouri,data_in/articles\2024-01-03_1516.txt
2024,01,03,EU foreign policy chief says world must ‘impose’ solution to Gaza war,data_in/articles\2024-01-03_1517.txt
2024,01,03,Algerian footballer Youcef Atal convicted in France over post on Gaza war,data_in/articles\2024-01-03_1518.txt
2024,01,03,Photos: Ruin and desperation in Gaza as Israeli onslaught continues to rage,data_in/articles\2024-01-03_1519.txt
2024,01,03,"Israel’s war on Gaza: List of key events, day 89",data_in/articles\2024-01-03_1520.txt
2024,01,03,"Who was Saleh al-Arouri, the Hamas leader killed in Beirut?",data_in/articles\2024-01-03_1521.txt
2024,01,03,Israel-Hamas updates: Nasrallah says not afraid of war after Beirut attack,data_in/articles\2024-01-03_1522.txt
2024,01,04,Israeli defence minister outlines new phase in Gaza war,data_in/articles\2024-01-04_1500.txt
2024,01,04,Will Iran retaliate after the deadly bombings in Kerman?,data_in/articles\2024-01-04_1501.txt
2024,01,04,Beirut bombings: Israel’s long history of assassination attempts in Lebanon,data_in/articles\2024-01-04_1502.txt
2024,01,04,"The Take: Israel, Palestine, BDS, and the right to boycott in the US",data_in/articles\2024-01-04_1503.txt
2024,01,04,US to send top diplomats to Middle East as regional tensions spread,data_in/articles\2024-01-04_1504.txt
2024,01,04,"Israel’s war on Gaza: List of key events, day 90",data_in/articles\2024-01-04_1505.txt
2024,01,04,Israeli military strikes south Lebanon stoking fears of widening conflict,data_in/articles\2024-01-04_1506.txt
2024,01,04,Gaza women and the isdal robes that shield them as war strips their privacy,data_in/articles\2024-01-04_1507.txt
2024,01,04,Netanyahu’s bait: Why Israel might have killed Hamas leaders in Beirut now,data_in/articles\2024-01-04_1508.txt
2024,01,04,Hunger hits displaced Palestinians and animals in Gaza zoo,data_in/articles\2024-01-04_1509.txt
2024,01,04,Photos: Palestinians flee Nuseirat refugee camp once again amid attacks,data_in/articles\2024-01-04_1510.txt
2024,01,05,Hezbollah chief warns Lebanon could be ‘exposed’ to more Israeli attacks,data_in/articles\2024-01-05_1493.txt
2024,01,05,Shipping giant Maersk to avoid Red Sea routes for ‘foreseeable future’,data_in/articles\2024-01-05_1494.txt
2024,01,05,A Hamas leader is killed – what’s the state of play in the Middle East?,data_in/articles\2024-01-05_1495.txt
2024,01,05,What is Israel’s latest ‘day after’ plan for Gaza?,data_in/articles\2024-01-05_1496.txt
2024,01,05,‘He’s breathing’: My two hours under Gaza’s rubble after an Israeli strike,data_in/articles\2024-01-05_1497.txt
2024,01,05,Israel launches attacks across Gaza amid spike in regional tensions,data_in/articles\2024-01-05_1498.txt
2024,01,05,"Israel’s war on Gaza: List of key events, day 91",data_in/articles\2024-01-05_1499.txt
2024,01,06,"Thousands protest in Israel demanding captive release, government to resign",data_in/articles\2024-01-06_1482.txt
2024,01,06,Pro-Palestine protesters block bridge outside UK parliament,data_in/articles\2024-01-06_1483.txt
2024,01,06,"US diplomat Blinken meets Turkey’s Erdogan, kicking off Gaza diplomacy tour",data_in/articles\2024-01-06_1484.txt
2024,01,06,"Former US general: Israel may win in Gaza, but fail in the region",data_in/articles\2024-01-06_1485.txt
2024,01,06,Safe zones: Israel’s technologies of genocide,data_in/articles\2024-01-06_1486.txt
2024,01,06,Genocide in Gaza: The context,data_in/articles\2024-01-06_1487.txt
2024,01,06,Hezbollah fires rockets at Israel in ‘response’ to Hamas leader’s killing,data_in/articles\2024-01-06_1488.txt
2024,01,06,Will the Houthi Red Sea attacks destabilise Yemen’s fragile peace?,data_in/articles\2024-01-06_1489.txt
2024,01,06,"Israel’s war on Gaza: List of key events, day 92",data_in/articles\2024-01-06_1490.txt
2024,01,06,Why is Lebanon home to so many Palestinian refugees and leaders?,data_in/articles\2024-01-06_1491.txt
2024,01,06,Israel war on Gaza updates: Children dying ‘in every possible way’,data_in/articles\2024-01-06_1492.txt
2024,01,07,Blinken says Palestinians displaced in Gaza must be able to return home,data_in/articles\2024-01-07_1473.txt
2024,01,07,What’s behind Antony Blinken’s latest visit to the Middle East?,data_in/articles\2024-01-07_1474.txt
2024,01,07,Jordan’s King Abdullah II presses Blinken to push for a ceasefire in Gaza,data_in/articles\2024-01-07_1475.txt
2024,01,07,"Hamza, son of Al Jazeera’s Wael Dahdouh, killed in Israeli attack in Gaza",data_in/articles\2024-01-07_1476.txt
2024,01,07,Israel signals bombardment of northern Gaza set to end,data_in/articles\2024-01-07_1477.txt
2024,01,07,‘Victory photo’: Will Beirut killings help embattled Netanyahu politically?,data_in/articles\2024-01-07_1478.txt
2024,01,07,"At least nine Palestinians, two Israelis killed in West Bank violence",data_in/articles\2024-01-07_1479.txt
2024,01,07,"Israel’s war on Gaza: List of key events, day 93",data_in/articles\2024-01-07_1480.txt
2024,01,07,Israel war on Gaza updates: Condemnation after Israel kills 2 journalists,data_in/articles\2024-01-07_1481.txt
2024,01,08,US officials renew calls for Israel to reduce civilian casualties in Gaza,data_in/articles\2024-01-08_1466.txt
2024,01,08,What international solidarity exists with journalists under Israeli attack?,data_in/articles\2024-01-08_1467.txt
2024,01,08,How a parkour group in Gaza turns war ruins into sporting arenas,data_in/articles\2024-01-08_1468.txt
2024,01,08,Israel says it is scaling down north Gaza operations. What does that mean?,data_in/articles\2024-01-08_1469.txt
2024,01,08,Hezbollah says Israel kills top commander amid fears of Gaza war escalation,data_in/articles\2024-01-08_1470.txt
2024,01,08,"Remembering Issa al-Souri, a little boy killed when Israel bombed a church",data_in/articles\2024-01-08_1471.txt
2024,01,08,"Israel’s war on Gaza: List of key events, day 94",data_in/articles\2024-01-08_1472.txt
2024,01,09,Q&A: Former Biden appointee says US policy is ‘dehumanising’ Palestinians,data_in/articles\2024-01-09_1458.txt
2024,01,09,British FM ‘worried’ Israel may have breached international law in Gaza,data_in/articles\2024-01-09_1459.txt
2024,01,09,Israel’s war on Gaza and the ‘obligation to prevent genocide’,data_in/articles\2024-01-09_1460.txt
2024,01,09,Blinken says civilian death toll in Gaza ‘far too high’,data_in/articles\2024-01-09_1461.txt
2024,01,09,How does the war on Gaza affect mental health of Palestinian children?,data_in/articles\2024-01-09_1462.txt
2024,01,09,Which countries back South Africa’s genocide case against Israel at ICJ?,data_in/articles\2024-01-09_1463.txt
2024,01,09,A Gaza footballer’s journey from pitch to hospital amid Israel’s war,data_in/articles\2024-01-09_1464.txt
2024,01,09,"Israel’s war on Gaza: List of key events, day 95",data_in/articles\2024-01-09_1465.txt
2024,01,10,Is Israel committing genocide in Gaza?,data_in/articles\2024-01-10_1448.txt
2024,01,10,"US top diplomat Blinken meets Abbas, discusses Palestinian statehood",data_in/articles\2024-01-10_1449.txt
2024,01,10,WHO facing ‘near insurmountable challenges’ in Gaza aid delivery,data_in/articles\2024-01-10_1450.txt
2024,01,10,‘Threatened with rape’: Lama Khater recalls horrors while in Israeli jails,data_in/articles\2024-01-10_1451.txt
2024,01,10,Terrified people flee Israeli attacks at Al-Aqsa Martyrs Hospital,data_in/articles\2024-01-10_1452.txt
2024,01,10,The Take: The Houthis’ grip on Red Sea trade,data_in/articles\2024-01-10_1453.txt
2024,01,10,Israeli army appears to change tack on strike that killed Gaza journalists,data_in/articles\2024-01-10_1454.txt
2024,01,10,"‘Devastated, heartbroken’: Against the odds, Gaza aid providers keep going",data_in/articles\2024-01-10_1455.txt
2024,01,10,"Israel’s war on Gaza: List of key events, day 96",data_in/articles\2024-01-10_1456.txt
2024,01,10,"US, UK forces shoot down 21 drones and missiles fired by Houthis",data_in/articles\2024-01-10_1457.txt
2024,01,11,Gaza daily deaths exceed all other major conflicts in 21st century: Oxfam,data_in/articles\2024-01-11_1432.txt
2024,01,11,What plans does Washington have for Gaza?,data_in/articles\2024-01-11_1433.txt
2024,01,11,Any US attack on Yemen’s Houthis will ‘not go without response’,data_in/articles\2024-01-11_1434.txt
2024,01,11,"Lebanon and Israel ‘prefer’ diplomatic end to tensions, US envoy says",data_in/articles\2024-01-11_1435.txt
2024,01,11,Day one of the ICJ genocide hearing against Israel: Key takeaways,data_in/articles\2024-01-11_1436.txt
2024,01,11,"Blinken says path to a Palestinian state can stabilise region, isolate Iran",data_in/articles\2024-01-11_1437.txt
2024,01,11,ICJ hears South Africa’s genocide case against Israel over Gaza war,data_in/articles\2024-01-11_1438.txt
2024,01,11,Protests as UN top court hears genocide case against Israel over Gaza war,data_in/articles\2024-01-11_1439.txt
2024,01,11,The Take: The last keffiyeh factory in Palestine,data_in/articles\2024-01-11_1440.txt
2024,01,11,"French historian: Israel destroyed 4,000-year-old culture in Gaza",data_in/articles\2024-01-11_1441.txt
2024,01,11,Nobel winner joins push to boycott German cultural institutions over Gaza,data_in/articles\2024-01-11_1442.txt
2024,01,11,A quick guide to South Africa’s ICJ case against Israel,data_in/articles\2024-01-11_1443.txt
2024,01,11,"Israel’s war on Gaza: List of key events, day 97",data_in/articles\2024-01-11_1444.txt
2024,01,11,ICJ updates: South Africa’s genocide case against Israel over Gaza war,data_in/articles\2024-01-11_1445.txt
2024,01,11,UN Security Council demands Houthis stop Red Sea shipping attacks,data_in/articles\2024-01-11_1446.txt
2024,01,11,‘Still no endgame’ as Blinken concludes latest Middle East tour: Analysts,data_in/articles\2024-01-11_1447.txt
2024,01,12,‘Dangerous’: US attacks on Yemen’s Houthis belie push for de-escalation,data_in/articles\2024-01-12_1417.txt
2024,01,12,"Oil prices steady despite Middle East tensions, but risks are rising",data_in/articles\2024-01-12_1418.txt
2024,01,12,ICJ genocide case: What are Israel’s arguments and do they hold up?,data_in/articles\2024-01-12_1419.txt
2024,01,12,Israel rejects accusations of genocide in Gaza war at ICJ hearing,data_in/articles\2024-01-12_1420.txt
2024,01,12,The Take: Why South Africa is suing Israel for genocide in Gaza,data_in/articles\2024-01-12_1421.txt
2024,01,12,Who are the Houthis? A simple guide to the Yemeni group,data_in/articles\2024-01-12_1422.txt
2024,01,12,Has Biden violated the US Constitution by bombing Yemen?,data_in/articles\2024-01-12_1423.txt
2024,01,12,Will Morocco stay the course on Israel normalisation?,data_in/articles\2024-01-12_1424.txt
2024,01,12,What is South Africa’s five-point ICJ argument against Israel?,data_in/articles\2024-01-12_1425.txt
2024,01,12,"World reacts to US, UK attacks on Houthi targets in Yemen",data_in/articles\2024-01-12_1426.txt
2024,01,12,"How the US, UK bombing of Yemen might help the Houthis",data_in/articles\2024-01-12_1427.txt
2024,01,12,"From a Palestinian in Gaza, thank you South Africa!",data_in/articles\2024-01-12_1428.txt
2024,01,12,"Israel’s war on Gaza: List of key events, day 98",data_in/articles\2024-01-12_1429.txt
2024,01,12,US and UK launch strikes against Yemen; Houthi rebels promise to retaliate,data_in/articles\2024-01-12_1430.txt
2024,01,12,ICJ updates: Israel’s response to South Africa’s genocide case,data_in/articles\2024-01-12_1431.txt
2024,01,13,Hundreds of thousands rally globally for Gaza on eve of 100 days of war,data_in/articles\2024-01-13_1408.txt
2024,01,13,Pro-Palestine protests held around the world as Gaza war nears 100 days,data_in/articles\2024-01-13_1409.txt
2024,01,13,How I stopped being a cartoonist and became a ‘troll’,data_in/articles\2024-01-13_1410.txt
2024,01,13,Have the Houthi Red Sea attacks hurt Israel’s economy?,data_in/articles\2024-01-13_1411.txt
2024,01,13,"Blackout in Gaza’s Al-Aqsa Hospital as fuel runs out, babies at high risk",data_in/articles\2024-01-13_1412.txt
2024,01,13,"Israel’s war on Gaza: List of key events, day 99",data_in/articles\2024-01-13_1413.txt
2024,01,13,US launches new strikes on Yemen’s Houthis as conflict escalates,data_in/articles\2024-01-13_1414.txt
2024,01,13,Shot in ‘cold blood’: Killing of Palestinian grandmother sparks outcry,data_in/articles\2024-01-13_1415.txt
2024,01,13,Republican caucuses? Iowa’s Arabs and Muslims are more concerned with Gaza,data_in/articles\2024-01-13_1416.txt
2024,01,14,Palestine lose to Iran but win hearts on ‘special night’ at Asian Cup,data_in/articles\2024-01-14_1397.txt
2024,01,14,How long can Israel’s war on Gaza continue?,data_in/articles\2024-01-14_1398.txt
2024,01,14,Hezbollah says US strikes on Yemen’s Houthis harm maritime security,data_in/articles\2024-01-14_1399.txt
2024,01,14,"Israel vows not to ‘stop’ as Gaza death toll nears 24,000 on day 100 of war",data_in/articles\2024-01-14_1400.txt
2024,01,14,"Al Jazeera’s Samer Abudaqa was ‘targeted’, left to bleed by Israel: Report",data_in/articles\2024-01-14_1401.txt
2024,01,14,Iran vs Palestine 4-1: AFC Asian Cup 2023 – as it happened,data_in/articles\2024-01-14_1402.txt
2024,01,14,"Portuguese FM: Ukraine can prevail, Russia a ‘Paper Tiger’",data_in/articles\2024-01-14_1403.txt
2024,01,14,What will be the outcome of the ICJ genocide case against Israel?,data_in/articles\2024-01-14_1404.txt
2024,01,14,"Israel’s war on Gaza: List of key events, day 100",data_in/articles\2024-01-14_1405.txt
2024,01,14,Namibia condemns Germany for defending Israel in ICJ genocide case,data_in/articles\2024-01-14_1406.txt
2024,01,14,A ‘cultural genocide’: Which of Gaza’s heritage sites have been destroyed?,data_in/articles\2024-01-14_1407.txt
2024,01,15,Iran launches missile strikes in Iraq and Syria citing security threats,data_in/articles\2024-01-15_1383.txt
2024,01,15,Israeli forces kill three Palestinians in occupied West Bank,data_in/articles\2024-01-15_1384.txt
2024,01,15,Hamas claims two Israeli captives killed in Gaza air strikes,data_in/articles\2024-01-15_1385.txt
2024,01,15,"Yemen’s Houthis hit US-owned ship in missile attack, US military says",data_in/articles\2024-01-15_1386.txt
2024,01,15,Are the Houthi Red Sea interceptions going to bring about a regional war?,data_in/articles\2024-01-15_1387.txt
2024,01,15,The Take: The discontent brewing in the Biden administration over Gaza,data_in/articles\2024-01-15_1388.txt
2024,01,15,"This past week, we all became South Africans",data_in/articles\2024-01-15_1389.txt
2024,01,15,UK’s alleged use of Cyprus bases to arm Israel and hit Yemen draw protests,data_in/articles\2024-01-15_1390.txt
2024,01,15,Turkey frees Israeli footballer detained over Gaza war reference in match,data_in/articles\2024-01-15_1391.txt
2024,01,15,"‘Baba, this isn’t camping’: On being displaced by Israel’s war on Gaza",data_in/articles\2024-01-15_1392.txt
2024,01,15,‘Shame’: Palestine UN mission decries Blinken’s post ignoring Gaza killings,data_in/articles\2024-01-15_1393.txt
2024,01,15,"Israel’s war on Gaza: List of key events, day 101",data_in/articles\2024-01-15_1394.txt
2024,01,15,Palestine to Africa: How maps lie — and some tell the truth,data_in/articles\2024-01-15_1395.txt
2024,01,15,Israel’s war on Gaza updates: Israeli attacks kill 25 overnight in Gaza,data_in/articles\2024-01-15_1396.txt
2024,01,16,What might be the consequences of Israeli violence in occupied West Bank?,data_in/articles\2024-01-16_1372.txt
2024,01,16,Qatar announces Israel-Hamas deal for medicine and aid to enter Gaza,data_in/articles\2024-01-16_1373.txt
2024,01,16,Yemen’s Houthis claim attack on ship in Red Sea as US confirms new strike,data_in/articles\2024-01-16_1374.txt
2024,01,16,Israel’s new $15bn war budget: What’s it for and what gets cut?,data_in/articles\2024-01-16_1375.txt
2024,01,16,US claims seizure of Iranian weapons bound for Yemen’s Houthis,data_in/articles\2024-01-16_1376.txt
2024,01,16,Strike threat over claim pro-Israeli lobby forced out Australian journalist,data_in/articles\2024-01-16_1377.txt
2024,01,16,"Remembering Refaat Alareer, in the words of his student",data_in/articles\2024-01-16_1378.txt
2024,01,16,Israel’s war on Gaza and the West’s credibility crisis,data_in/articles\2024-01-16_1379.txt
2024,01,16,"Altruism, opportunism or both: What pushed South Africa to ICJ over Gaza?",data_in/articles\2024-01-16_1380.txt
2024,01,16,Palestinian village fears Israel wartime demolitions,data_in/articles\2024-01-16_1381.txt
2024,01,16,"Israel’s war on Gaza: List of key events, day 102",data_in/articles\2024-01-16_1382.txt
2024,01,17,Biden ‘playing with fire’ by re-designating Yemen’s Houthis as ‘terrorists’,data_in/articles\2024-01-17_1362.txt
2024,01,17,Israel ramps up attacks on Khan Younis as aid for Gaza arrives in Egypt,data_in/articles\2024-01-17_1363.txt
2024,01,17,US designates Yemen’s Houthis as ‘global terrorists’,data_in/articles\2024-01-17_1364.txt
2024,01,17,Trauma replaces joy for mothers giving birth during Israel’s war on Gaza,data_in/articles\2024-01-17_1365.txt
2024,01,17,Gaza will be the grave of the Western-led world order,data_in/articles\2024-01-17_1366.txt
2024,01,17,Israel’s war on Gaza triggered a war on free speech in the West,data_in/articles\2024-01-17_1367.txt
2024,01,17,Aid headed into Gaza after Israel-Hamas seal first deal since truce ended,data_in/articles\2024-01-17_1368.txt
2024,01,17,Al Jazeera’s Gaza bureau chief Wael Dahdouh in Qatar for medical treatment,data_in/articles\2024-01-17_1369.txt
2024,01,17,"Israel’s war on Gaza: List of key events, day 103",data_in/articles\2024-01-17_1370.txt
2024,01,17,US federal workers risk livelihoods in push for course change on Gaza war,data_in/articles\2024-01-17_1371.txt
2024,01,18,Israel’s Netanyahu reiterates rejection of Palestinian state after Gaza war,data_in/articles\2024-01-18_1353.txt
2024,01,18,Blackouts in Gaza must not be used as ‘weapons of war’: Rights group,data_in/articles\2024-01-18_1354.txt
2024,01,18,Israeli arrests of Palestinian journalists soared in 2023: CPJ,data_in/articles\2024-01-18_1355.txt
2024,01,18,What the designation of ‘terrorist’ means for Yemen’s Houthis,data_in/articles\2024-01-18_1356.txt
2024,01,18,Why does the US act as Israel’s lawyer?,data_in/articles\2024-01-18_1357.txt
2024,01,18,Maghazi residents left reeling after Israeli forces withdraw,data_in/articles\2024-01-18_1358.txt
2024,01,18,"Aid for Israeli captives, Palestinians reaches Gaza despite challenges",data_in/articles\2024-01-18_1359.txt
2024,01,18,"Israel’s war on Gaza: List of key events, day 104",data_in/articles\2024-01-18_1360.txt
2024,01,18,US launches new strikes on Houthi targets in Yemen,data_in/articles\2024-01-18_1361.txt
2024,01,19,"‘Until Israel stops!’: Yemenis rally for Houthis, Palestinians in Sanaa",data_in/articles\2024-01-19_1340.txt
2024,01,19,"Palestine, the alchemy of big lies and future of the university",data_in/articles\2024-01-19_1341.txt
2024,01,19,‘Criminal complaints’ filed against Israeli President Herzog in Switzerland,data_in/articles\2024-01-19_1342.txt
2024,01,19,Israeli minister says only a deal can free captives as rifts split cabinet,data_in/articles\2024-01-19_1343.txt
2024,01,19,Non-Aligned Movement criticises Israel’s war on Gaza at Kampala summit,data_in/articles\2024-01-19_1344.txt
2024,01,19,The Take: Why is Germany supporting Israel at the ICJ?,data_in/articles\2024-01-19_1345.txt
2024,01,19,"Gaza’s morning ritual: Searching under rubble for dolls, books, loved ones",data_in/articles\2024-01-19_1346.txt
2024,01,19,"UN says Palestinians detained by Israeli forces humiliated, beaten",data_in/articles\2024-01-19_1347.txt
2024,01,19,Palestinians in Ukraine decry ‘double standard’ as Kyiv supports Israel,data_in/articles\2024-01-19_1348.txt
2024,01,19,Palestinians welcome Chile and Mexico’s call for ICC probe into Gaza war,data_in/articles\2024-01-19_1349.txt
2024,01,19,‘Credibility at stake’: Why did Iran strike inside Pakistan amid Gaza war?,data_in/articles\2024-01-19_1350.txt
2024,01,19,"Israel’s war on Gaza: List of key events, day 105",data_in/articles\2024-01-19_1351.txt
2024,01,19,US says ‘not at war’ with Houthis; Biden admits strikes not halting attacks,data_in/articles\2024-01-19_1352.txt
2024,01,20,Can international justice stop Israel?,data_in/articles\2024-01-20_1331.txt
2024,01,20,"‘Refuse to fight’: Jewish, Arab activists call for peace in Israel’s Haifa",data_in/articles\2024-01-20_1332.txt
2024,01,20,Residential building destroyed in attack that killed IRGC members in Syria,data_in/articles\2024-01-20_1333.txt
2024,01,20,"Israel drops leaflets seeking intel on captives, as Gaza attacks continue",data_in/articles\2024-01-20_1334.txt
2024,01,20,Palestinians accuse Israeli forces of executing 19 civilians in Gaza,data_in/articles\2024-01-20_1335.txt
2024,01,20,Oil supply tightens in Europe over Red Sea disruptions,data_in/articles\2024-01-20_1336.txt
2024,01,20,Hijacking truth: How open source intel in Gaza fell prey to groupthink,data_in/articles\2024-01-20_1337.txt
2024,01,20,Iran’s IRGC says 5 members killed in Israeli attack on Syria’s Damascus,data_in/articles\2024-01-20_1338.txt
2024,01,20,"Israel’s war on Gaza: List of key events, day 106",data_in/articles\2024-01-20_1339.txt
2024,01,21,Reporter’s Notebook: Covering an antiwar protest in Israel,data_in/articles\2024-01-21_1319.txt
2024,01,21,"Hamas says October 7 attack was a ‘necessary step’, admits to ‘some faults’",data_in/articles\2024-01-21_1320.txt
2024,01,21,Wounded Palestinians treated on French warship off Egyptian shore,data_in/articles\2024-01-21_1321.txt
2024,01,21,Israel approves plan to transfer Gaza tax funds to Norway,data_in/articles\2024-01-21_1322.txt
2024,01,21,"Gaza death toll surpasses 25,000 as Israel escalates assault",data_in/articles\2024-01-21_1323.txt
2024,01,21,"Remembering a vibrant artist and mother killed in Gaza, Baraa Abu Mohsen",data_in/articles\2024-01-21_1324.txt
2024,01,21,"Palestinian industries falter as Israel bombs Gaza, locks down West Bank",data_in/articles\2024-01-21_1325.txt
2024,01,21,US base attacked in Iraq hours after Iran vows revenge for Damascus attack,data_in/articles\2024-01-21_1326.txt
2024,01,21,Israel’s Netanyahu doubles down on opposition to Palestinian statehood,data_in/articles\2024-01-21_1327.txt
2024,01,21,What’s the cost of the war on Gaza for Palestine and Israel?,data_in/articles\2024-01-21_1328.txt
2024,01,21,"Israel’s war on Gaza: List of key events, day 107",data_in/articles\2024-01-21_1329.txt
2024,01,21,Palestinian-American teen one of hundreds killed by Israelis in West Bank,data_in/articles\2024-01-21_1330.txt
2024,01,22,US demands ‘urgent’ Israeli probe into Palestinian-American child’s death,data_in/articles\2024-01-22_1306.txt
2024,01,22,"US, UK strike eight Houthi targets over Red Sea shipping attacks",data_in/articles\2024-01-22_1307.txt
2024,01,22,Could a divided Jewish base upend US Democrats’ presidential hopes?,data_in/articles\2024-01-22_1308.txt
2024,01,22,Palestinians flee Khan Younis as Israel steps up ground operation,data_in/articles\2024-01-22_1309.txt
2024,01,22,"The olive tree, symbol of Palestine and mute victim of Israel’s war on Gaza",data_in/articles\2024-01-22_1310.txt
